Name,Eligibility,Eligible,Links_online_application,Contacts_offline_applications,Special_Categories,Scholarship_Fellowship,Level,State,Application_Period
UGC National Fellowship for Scheduled Caste Students (NFSC),1. SC category students pursuing research leading to the award of an MPhil/PhD degree are eligible. 2. They must have qualified for the UGC-NET-JRF or CSIR-NET-JRF examination.,Ph.D/Doctorate,https://nfsc.ugc.ac.in/,,Open for all,Fellowship,Central, ,May and July
National Fellowship for Persons with Disabilities,1. The fellowship is open to students with disabilities. 2. They must have been admitted to an MPhil/PhD degree in a recognized University/Academic Institution.,Ph.D/Doctorate,https://www.ugc.gov.in/,,Open for all,Fellowship,Central, ,January and February
Abdul Kalam Technology Innovation National Fellowship,1. Indian nationals working in India in various capacities of the engineering profession in public-funded institutions are eligible. 2. They must possess adequate professional qualifications and hold at least a bachelor’s degree. 3. They must have a minimum of 5 years of service left in the parent organization as of the date of the award.,PG,https://www.inae.in/,,Open for all,Fellowship,Central, ,May to June
SERB Ramanujan Fellowship,1. Brilliant scientists or engineers from abroad who are below 40 years of age are eligible. 2. They must possess a higher degree or equivalent such as a PhD in Science/Engineering Masters in Engineering or Technology/MD in Medicine etc. 3. They must have adequate professional experience. 4. They must have a proven/outstanding track record as evidence from their research publications and recognitions. 5. They must be working abroad at the time of nomination.,Ph.D/Doctorate,https://serb.gov.in/,,Open for all,Fellowship,Central, ,Always Open
CSIR Nehru Science Postdoctoral Research Fellowship,1. Indian citizens who hold a PhD degree can apply within three years of the award of a PhD degree. 2. Candidates who have submitted their PhD thesis can also apply. 3. They must not be more than 32 years of age.,Ph.D/Doctorate Researcher,https://www.csir.res.in/career-opportunities/recruitment/list-selected-candidates-post-scientists-sr-scientists-principal,,Open for all,Fellowship,Central, ,Always Open
CSIR Bhatnagar Fellowship,1. Indian citizens below 67 years of age are eligible. 2. They must associate with a mission or thrust area program of CSIR or an area of interest to CSIR. 3. They must be active scientists/technologists.,Ph.D/Doctorate,,ssb@csirhrdg.res.in,Open for all,Fellowship,Central, ,Always Open
SBI Youth for India Fellowship,1. The fellowship is open to highly motivated young professionals or fresh graduates out of college. 2. They must be between 21 and 32 years of age at the commencement of the programme. 3. Applicable for Indian citizens or Overseas Citizens of India. 4. They must be team players with proactive approaches and strong leadership skills. 5. They must be willing to commit to a 13-month-long rural fellowship programme and adapt to life in challenging rural conditions.,PG,https://youthforindia.org/,,Open for all,Fellowship,Central, ,March to April
UGC-NET Junior Research Fellowship,1. The fellowship is open to candidates who have qualified for UGC-NET or UGC-CSIR joint test. 2. They must hold a master’s degree in Humanities Science and Social Science stream with at least 55% marks. 3. The age of the candidates must not be more than 30 years. 4. Candidates who are in the final year of their Master’s degree and whose results are awaited can also apply.,Researcher,https://www.ugc.gov.in/,,Open for all,Fellowship,Central, ,March to April
Raman Research Fellowship,1. The fellowship is open to regular scientists of CSIR. 2. They must be having high academic qualifications i.e. post-graduation in Engineering and PhD in Natural Science. 3. They must have a research experience of at least 5 years in CSIR. 4. They must be presently working in high-priority areas. 5. They must have contributed to research/innovation in the proposed area at the international level. 6. The age of the candidates must not be more than 45 years.,Researcher,https://www.csir.res.in/sites/default/files/2023-12/Detail%20%20Advt.%20-%2008.12.2023.pdf,,Open for all,Fellowship,Central, ,November to February
3CS Media Fellowship,Dalit and Adivasi journalists from coastal South India-Karnataka Kerala Tamil Nadu Andhra Pradesh Telangana and from the Union Territories of Pondicherry Lakshadweep and Andaman & Nicobar Islands. Women are particularly encouraged to apply,Ph.D/Doctorate,,3cs.mediafellowship@ashoka.edu.in,Open for all,Fellowship,Private Organization, ,April 1 – November 30 2022
52 Parindey Fellowship,Applicants should be between the ages of 18-30; in the pursuit of livelihoods; interested in experiencing Travel as a pedagogy for learning; action-oriented with a willingness to apply their writing skills,PG Ph.D/Doctorate,https://www.travellersuniversity.org/52-parindey-fellowship,,Open for all,Fellowship,Private Organization, ,May 15th 2022
Aavishkar Fellowship,A bachelors degree in Math or Science (or associated fields) learning attitude and aptitude for problem-solving ability to communicate emphatically and assertively in Hindi and English,PG Ph.D/Doctorate,,,Open for all,Fellowship,Private Organization, ,April 25th 2020
Acumen Regional Fellows India,Fluency in English; fellows must demonstrate a commitment to ending poverty and injustice in their community through their work,PG Ph.D/Doctorate,https://acumen.org/Fellowship/india/,,Open for all,Fellowship,Private Organization, ,Always Open
Adivasi Awaaz Media Fellowship,fellowship is open to Adivasi/indigenous/tribal independent journalists/filmmakers from any part of the country,PG Ph.D/Doctorate,https://www.adivasilivesmatter.com/aipp,,Open for all,Fellowship,Private Organization, ,August 30th 2022
AIF William J. Clinton Fellowship for Service in India,US or Indian citizens aged 21-34 having a bachelor’s degree,PG Ph.D/Doctorate,https://aiffellowship.smapply.io/,,Open for all,Fellowship,Private Organization, ,October
Anant Fellowship,Undergraduate or postgraduate degree in any discipline,UG PG,https://anu.edu.in/programme/anant-fellowship/,,Open for all,Fellowship,Private Organization, ,January 31 2023
Arts for Good Fellowship,Minimum two years of professional/voluntary experience preferably in the education/social sector; prior experience working with a community through the arts demonstrating a strong interest in arts-based projects aimed at creating social impact; fluency in English; any age and nationality; ability to attend all components of the programme among others,Work_Experience,,,Open for all,Fellowship,Private Organization, ,
Ashoka Fellowship,Entrepreneurs with a new system changing idea that addresses pertinent social or environmental issues,Ph.D/Doctorate,https://www.ashoka.org/en-in/ashoka-fellows,,Open for all,Fellowship,Private Organization, ,Always Open
Ashoka Young Changemakers,Under 20 years of age founder/co-founder of an initiative that is addressing social or environmental issues at the community level,PG,https://www.ashoka.org/en-in/program/ashoka-young-changemakers,,Open for all,Fellowship,Private Organization, ,Always Open
Asia Foundation Development Fellows Program,Must have a demonstrable record of experience in one of governance and law economic development women’s empowerment environment or regional cooperation; under 40 years of age; conversant in English; citizens of Afghanistan Bangladesh Cambodia China India Indonesia Japan Korea Laos Malaysia Mongolia Myanmar Nepal Pakistan Philippines Singapore Sri Lanka Thailand Timor-Leste or Vietnam,PG,,,Open for all,Fellowship,Private Organization, ,
Atlantic Fellows for Social and Economic Equity,Graduate in any discipline; at least 5 years relevant experience; must meet LSE’s standard English Language Requirement,PG Others,,,Open for all,Fellowship,Private Organization, ,
Azim Premji Foundation Fellowship,4-10 years’ work experience; degree in any discipline; proficiency in English and one of Hindi Kannada Tamil or Telugu; below 35 years of age,Work_Experience,https://azimpremjifoundation.org/,,Open for all,Fellowship,Private Organization, ,October
BasicShit Fellow,Applicants should be 18 and over; available to work in-person in Delhi for at least the first four weeks,Work_Experience,https://docs.google.com/forms/d/e/1FAIpQLSdjmSroBhayyzlPYvw1fCUPpnU5kG60fG0kO9U_6Ubdyb993Q/viewform,,Open for all,Fellowship,Private Organization, ,Always Open
Bhumi Fellowship,Young graduates willing to commit to two years and who can read and speak Tamil fluently,Others,https://fellowship.bhumi.ngo/#apply,,Open for all,Fellowship,Private Organization, ,April
Buddha Fellowship,Fresh graduates from IIT/IIM or professionals/entrepreneurs,PG,https://thebuddhainstitute.org/buddha-fellowship,,Open for all,Fellowship,Private Organization, ,
Centre for Humanitarian Data (UNOCHA) — Data Fellows Programme 2020,Undergraduate degree with at least 5 years of relevant experience or a graduate degree with 3 years of relevant experience,PG Others,,,Open for all,Fellowship,Private Organization, ,January
Charles Wallace India Trust Fellowship in Creative Writing,Indian citizens living in India 25-45 years of age; postgraduate degree and/or at least 5 years of experience,PG Others,,,Open for all,Fellowship,Private Organization, ,
Chief Minister Fellowship Program (Maharashtra),21-26 years of age; graduate with a first class; minimum one-year work experience; basic proficiency in Marathi,PG Others Work_Experience,https://mahades.maharashtra.gov.in/home.do?lang=en,,Open for all,Fellowship,Private Organization, ,June
Chief Minister’s Good Governance Associates Program (Haryana),Below 28 years of age; Indian citizens with bachelor’s degree and one year of work experience/postgraduate degree; proficiency in English and Hindi,PG Others Work_Experience,http://www.cmgga.in/,,Open for all,Fellowship,Private Organization, ,May
Chief Minister’s Urban Leaders Fellowship (CMULF),"Below 35 years of age. Post-Graduate with minimum 60% of marks (or equivalent CGPA). Professionals such as MBBS, LLB etc. with minimum 5 year course of study after 12th class considered as “Post Graduate”.",PG,,,Open for all,Fellowship,Private Organization, ,August
Citizens for Public Leadership Fellowship,Must be a minimum of 20 years old or a maximum of 35 years of age as of 2nd October; must hold at least a Bachelor’s degree (3-years minimum) as of 2nd October (we also encourage final year undergraduate students to apply); must be an Indian citizen,PG,https://cplindia.org/,,Open for all,Fellowship,Private Organization, ,October and November
Coalition for Disaster Resilient Infrastructure (CDRI) Fellowship,Open to candidates from CDRI member nations; students faculty researchers; practitioners from government agencies service agencies nonprofits and private organisations.,Researcher,https://cdri.world/fellowship,,Open for all,Fellowship,Private Organization, ,January
CSIP Research Fellowship,Individuals or small groups with several years of professional research experience based full-time in India who have the capacity to undertake rigorous research during the fellowship period and produce a working paper of publishable quality. Women LGBTQIA+ Dalit Adivasi people with disabilities and members of other minority and marginalised groups are particularly encouraged to apply.,Researcher,https://csip.ashoka.edu.in/research-fellowship-2023/,,Open for all,Fellowship,Private Organization, ,November
Data Fellows Programme,Graduates ( 4 years of relevant experience) and postgraduates (2 years of relevant experience,PG,https://centre.humdata.org/data-fellows/,,Open for all,Fellowship,Private Organization, ,March to April
Delhi Assembly Research Centre,Masters with one year experience for Fellows and Bachelors with one year experience for Associate Fellow,PG Others,https://delhiassembly.delhi.gov.in/sites/default/files/dlas/pdf/20190814acceptoffer.pdf,,Open for all,Fellowship,Private Organization, ,
Development Alternative’s Fellowship,Graduates and postgraduates,PG,https://devalt.org/,,Open for all,Fellowship,Private Organization, ,
Digital Swaraj Fellowship,20-26 year old India citizen who is a graduate. The applicant should be proficient in English (verbal and written).,PG,https://digitalswarajfellowship.org/,,Open for all,Fellowship,Private Organization, ,December
Disom – The leadership school,21 years or above of age; working knowledge of English and/or Hindi,Work_Experience,https://in.iofc.org/disom-the-leadership-school/application,,Open for all,Fellowship,Private Organization, ,October
Fellowship for Climate Action,Interest in implementing solutions to climate change,Others,https://anu.edu.in/programme/anant-fellowship-for-climate-action/,,Open for all,Fellowship,Private Organization, ,None
Forbes Foundation Fellowship,Nonprofit organisations based in India,Others,https://docs.google.com/forms/d/e/1FAIpQLSeLz1yRVE9iEvjcDzlGmjAPYxWXCkcL4gg4Np8EhpQlun3pyg/viewform,,Open for all,Fellowship,Private Organization, ,September
Gandhi Fellowship Program,Graduates/postgraduates; professionals below 26 years,PG,https://gandhifellowship.org/,,Open for all,Fellowship,Private Organization, ,March
Girish Sant Memorial Fellowship,Cannot be enrolled in an academic programme,PG,https://prayaspune.org/girish-sant/memorial/annual-lectures/memorial-annual-event-2020,,Open for all,Fellowship,Private Organization, ,February
Goonj Grassroots Fellowship,Between 18-30 years of age as on 31st July 2023; matriculation by 31st July 2023; Indian citizen; basic fluency in English and Hindi (reading writing and speaking),PG,https://goonj.org/goonj-grassroots-fellowship/,,Open for all,Fellowship,Private Organization, ,May
Goonj Urban Fellowship,Between 21-30 years of age as on 31st July 2023; graduation by 31st July 2023 in any discipline; Indian citizen; basic fluency in English and Hindi (reading writing and speaking),PG,https://goonj.org/goonj-urban-fellowship/,,Open for all,Fellowship,Private Organization, ,May
Grassroots Leadership Development Programme,Above 18 years of age; potential individual leaders associated with community based organisations nonprofits and other development organisations with minimum 2 years of association in the sector. Strongly encourage women candidates from marginalised communities that is Dalit Muslim ST NTDNT communities to apply.,Others,https://www.ushli.org/programs/grassroots-leadership-program/,,Open for all,Fellowship,Private Organization, ,January
Happy Children’s Fellowship Programme,Fluency in Hindi; demonstrable passion about working with children,Others,https://happychildrenslibrary.wordpress.com/happy-childrens-fellowship-programme/,,Open for all,Fellowship,Private Organization, ,February
Head Held High (HHH) Fellowship,18-30 years of age; Indian or international citizen,Others,https://head-held-high.org/,,Open for all,Fellowship,Private Organization, ,
iCFDR Fellowship,Final year students graduates and working professionals (21 years or above age),Work_Experience,https://idreamcareer.com/,,Open for all,Fellowship,Private Organization, ,Always Open
Ideosync UNESCO Information Fellowship,Citizen of India or Person of Indian Origin (PIO); below 30 years of age; Bachelor's degree or equivalent in any discipline; proficient in English; full-time access to a laptop smartphone and 4G internet,PG,https://www.iuif.in/,,Open for all,Fellowship,Private Organization, ,October
India for Mental Health Fellowship,Freelance reporters with multimedia experience understanding of data journalism and familiarity with non-English languages; 5-7 years of experience,Others,https://imhrc.org/fellowship.html,,Open for all,Fellowship,Private Organization, ,January
India Smart Cities Fellowship,Fresh graduates/postgraduates with 1st division or minimum 60 percent marks; or PhDs; below 35 years of age,PG Ph.D/Doctorate,https://niua.in/,,Open for all,Fellowship,Private Organization, ,August
Indian Administrative Fellowship,10+ years of achievement and capabilities in problem-solving influencing and leading large initiatives with successful outcomes,Others,https://iaf.thenudge.org/,,Open for all,Fellowship,Private Organization, ,December to January
Indicorps Fellowship,Indian citizens; a college/university degree or five years equivalent work experience; fluency in English,PG Work_Experience,https://www.indicorps.org/toolkit/,,Open for all,Fellowship,Private Organization, ,November
Indus Action’s Policy Action Fellowship,Graduates with 3+ years of work experience; strong data analytical skills; strong technical skills to manage the MIS system,Work_Experience,https://www.indusaction.org/,,Open for all,Fellowship,Private Organization, ,None
International Innovation Corps (IIC) India Program,Graduate with minimum 2 years of work experience; under 29 years of age,Work_Experience,https://www.iic.uchicago.edu/our-model,,Open for all,Fellowship,Private Organization, ,May
ISDM CDSSI Fellowship 2024-25: Digital Public Goods for Social Impact,Each Fellowship project must possess data science skills and a deep understanding of the social sector. Fellows can participate either individually or in teams. Teams should submit one application collectively. Individual Fellows should possess both skillsets. For Fellows applying as a team these skillsets can be distributed among members.,Others,https://www.isdm.org.in/cdssi-overview,,Open for all,Fellowship,Private Organization, ,January 15 2024
ISDM CIFSI Research Fellowship 2023,Indian researchers academic scholars and practitioners from the development sector. Applications from underrepresented and marginalised groups such as women LGBTQIA+ Dalits Adivasis and persons with disabilities are especially encouraged. Interdisciplinary approaches are encouraged.,Researcher,https://www.isdm.org.in/cifsi-overview,,Open for all,Fellowship,Private Organization, ,August 31 2023
ISDM CPID Research Fellowship Program 2023,Indian nationals with at least a bachelor’s degree. People from underrepresented and marginalised groups such as women LGBTQIA+ Dalits Adivasis and persons with disabilities are especially encouraged to apply.,Researcher,https://www.isdm.org.in/cpid-research-fellow,,Women LGBTQIA+ Dalits Adivasis Special-abled ,Fellowship,Private Organization, ,August 6 2023
JSW Foundation Fellowship,Graduate/post graduate/young professional with 1-7 years of work experience in science humanities engineering medicine agriculture or other professional streams; less than 30 years old as on 1st May 2023; fluent in English and at least one Indian language (for field projects),PG Work_Experience,https://www.jswfoundationfellowship.org/fellowship-application-form/,,Open for all,Fellowship,Private Organization, ,
Kanthari scholarship,kanthari is for people who have decided to start an organisation or nonprofit to make a difference welcoming applicants (minimum 22 years of age) who have overcome significant life challenges and carry a plan for social change because of that and who have a basic understanding of spoken and written English along with computer skills,Others,https://www.kanthari.org/admissions/,,Open for all,Fellowship,Private Organization, ,Always Open
Karmyo Foundation Fellowship,College students or working professionals passionate and enthusiastic to work with students in the age group of 12 to 16 years who are entrepreneurial in nature (preferred location: Meghalaya),Others,https://www.karmtrust.org/karmfellowshipProgram.html,,Open for all,Fellowship,Private Organization, ,May
Kshamtalaya iDiscover Fellowship,Applicants must have the legal status to work in India and functional knowledge of English,PG Ph.D/Doctorate,https://www.kshamtalaya.org/,,Open for all,Fellowship,Private Organization, ,
LEAD India Fellowship,Fluency in English; minimum five years of experience,Others,https://leadindia.org/fellows/application/,,Open for all,Fellowship,Private Organization, ,November
Lead Like Gandhi Fellowship,Nomination from a guardian; CXO or senior leader of an organisation,Others,https://leadlikegandhi.org/fellowship-design,,Open for all,Fellowship,Private Organization, ,February and November respectively
Leadership for Growth,Women who are founders/co-founders of a social enterprise operating in non-metropolitan cities of Karnataka Kerala or Tamil Nadu,Others,https://india.amaniinstitute.org/program/l4g-women-social-entrepreneurs/,,Open for all,Fellowship,Private Organization, ,December
LGT Impact Fellowship,Undergraduate degree (MBA or other advanced degree in a relevant field preferred); minimum of two years of full-time work experience after university (internships during studies excluded); proficiency in English both written and spoken (additional languages from relevant regions helpful),PG Work_Experience,https://www.lgtvp.com/en/lgt-fellowship,,Open for all,Fellowship,Private Organization, ,April
Mahatma Gandhi National Fellowship (MGNF),Has to be an Indian citizen bachelor’s degree three years of work experience after senior secondary in the social sector proficient in an Indian language,PG Work_Experience,https://www.iimb.ac.in/mgnf,,Open for all,Fellowship,Private Organization, ,March
Media Fellowship for The Camel Partnership,Media professionals who can develop original content–ranging from articles to photostories,Others,https://www.camelkidsfoundation.org/,,Open for all,Fellowship,Private Organization, ,April
Naropa Fellowship,A recognised undergraduate or postgraduate degree in any discipline,Ph.D/Doctorate,https://www.naropafellowship.org/,,Open for all,Fellowship,Private Organization, ,Always Open
NCEDP-Javed Abidi Fellowship on Disability,An Indian citizen between the age group of 18-28 years minimum secondary level of education fundamental knowledge of disability issues knowledge of written and spoken English or Hindi or any one of the regional languages is essential basic research and analysis skills and prior experience of working/volunteering in the development sector particularly in the disability sector will be an added advantage. Preference will be given to youth with disabilities. Young women with disabilities are highly encouraged to apply.,UG Work_Experience,https://ncpedp.org/ncpedp-appi-youth-fellowship-on-disability/,,Open for all,Fellowship,Private Organization, ,None
NCPEDP-Javed Abidi Fellowship on Disability,Applicants must be Indian citizens between the age group of 18-28 years and should have completed a minimum secondary level of education; preference will be given to youth with disabilities. However exceptional youth without disabilities with prior (academic/work/volunteer) experience in the disability sector will also be considered; fundamental knowledge of disability issues and other cross-cutting development issues in India is essential; excellent knowledge of written and spoken English or Hindi or any one of the regional languages is essential.,UG Work_Experience,https://ncpedp.org/ncpedp-appi-youth-fellowship-on-disability/,,Open for all,Fellowship,Private Organization, ,August
NIRMAN by SEARCH,18 to 28 years of age,UG,https://nirman.mkcl.org/,,Open for all,Fellowship,Private Organization, ,August
Praja Fellowship Program,Indian citizens above 18 years of age; students pursuing graduation or postgraduation; familiarity with English and Hindi,UG PG,https://www.praja.org/praja_docs/praja_downloads/Praja%20Elected%20Representatives%20Fellowship%202017-18.pdf,,Open for all,Fellowship,Private Organization, ,August
PRIME: Sauramandala Rural Entrepreneurship,Fellows: Between ages 24 and 35; Graduate/Postgraduate in any discipline; additional 2-3 years of experience working in rural development entrepreneurship agri-business incubation or startups; stipend of INR 40000/month. Associate: Between ages 20-28; Graduate/Postgraduate in any discipline (Freshers accepted); first demonstrated project research or field work experience related to rural development entrepreneurship agri-business incubation or startups; stipend of INR 30000/month,PG Work_Experience,https://www.primemeghalaya.com/fellowship/,,Open for all,Fellowship,Private Organization, ,June
Profugo Field Fellow,Master’s students,PG,https://profugo.org/engage/field-fellow/,,Open for all,Fellowship,Private Organization, ,May
Punjab Youth Leaders Program,Below 35 years of age; work experience of at least two years,Work_Experience,https://www.sanjhisikhiya.org/,,Open for all,Fellowship,Private Organization, ,None
Rajiv Gandhi National Fellowship for SC/ST candidates,SC/ST candidates who have passed postgraduate examinations,PG Others,https://www.ugc.gov.in/Error/Error_404?aspxerrorpath=/rgnf/,,Open for all,Fellowship,Private Organization, ,June
Rashtram Accelerator Programme,Need to be a postgraduate for the Academic track and a graduate for the Socio-Political track,PG,https://rashtram.org/accelerator-programme/,,Open for all,Fellowship,Private Organization, ,March
Ravi Sankaran Fellowship Program,Indian citizens with a demonstrated interest in wildlife ecology and conservation; bachelor’s degree; below 30 years of age,PG,https://indiabioscience.org/grants/the-ravi-sankaran-fellowship,,Open for all,Fellowship,Private Organization, ,April/May
Revitalising Rainfed Agriculture Network (RRA N) Fellowship,Inclination to address challenges of marginal farmers; interest and committed to work for rural India; basic reading and writing skills in English.,Others,https://rainfedindia.github.io/activities/,,Open for all,Fellowship,Private Organization, ,November to January
